{
  "version": "0.1",
  "domain": "generic",
  "intent": "draw_object",
  "object": { "type": "bed", "name": "Smoke Bed", "width": 2000, "depth": 1800 },
  "placement": { "mode": "absolute", "base_point": [0, 0, 0] },
  "drawing": { "layer": "CODEX_PREVIEW", "include_label": false, "include_dimensions": false },
  "confidence": 1.0,
  "needs_confirmation": false
}
