[
  {
    "version": "0.1",
    "domain": "generic",
    "intent": "draw_object",
    "object": {
      "type": "sofa",
      "name": "Sofa",
      "width": 2200,
      "depth": 900,
      "height": 850,
      "object_spec_id": "object-sofa-2200x900"
    },
    "placement": {
      "mode": "absolute",
      "base_point": [
        0.0,
        1650.0,
        0
      ]
    },
    "drawing": {
      "layer": "CODEX_PREVIEW",
      "include_label": false,
      "include_dimensions": false
    },
    "confidence": 0.9,
    "needs_confirmation": false
  },
  {
    "version": "0.1",
    "domain": "generic",
    "intent": "draw_object",
    "object": {
      "type": "table",
      "name": "Table",
      "width": 1200,
      "depth": 700,
      "height": 750,
      "object_spec_id": "object-table-1200x700"
    },
    "placement": {
      "mode": "absolute",
      "base_point": [
        2500.0,
        1650.0,
        0
      ]
    },
    "drawing": {
      "layer": "CODEX_PREVIEW",
      "include_label": false,
      "include_dimensions": false
    },
    "confidence": 0.9,
    "needs_confirmation": false
  },
  {
    "version": "0.1",
    "domain": "generic",
    "intent": "draw_object",
    "object": {
      "type": "shelf",
      "name": "Shelf",
      "width": 900,
      "depth": 350,
      "height": 2000,
      "object_spec_id": "object-shelf-900x350"
    },
    "placement": {
      "mode": "absolute",
      "base_point": [
        4000.0,
        1650.0,
        0
      ]
    },
    "drawing": {
      "layer": "CODEX_PREVIEW",
      "include_label": false,
      "include_dimensions": false
    },
    "confidence": 0.9,
    "needs_confirmation": false
  },
  {
    "version": "0.1",
    "domain": "generic",
    "intent": "draw_object",
    "object": {
      "type": "cabinet",
      "name": "Cabinet",
      "width": 1800,
      "depth": 600,
      "height": 2400,
      "object_spec_id": "object-cabinet-1800x600"
    },
    "placement": {
      "mode": "absolute",
      "base_point": [
        5200.0,
        1650.0,
        0
      ]
    },
    "drawing": {
      "layer": "CODEX_PREVIEW",
      "include_label": false,
      "include_dimensions": false
    },
    "confidence": 0.9,
    "needs_confirmation": false
  },
  {
    "version": "0.1",
    "domain": "generic",
    "intent": "draw_object",
    "object": {
      "type": "chair",
      "name": "Chair",
      "width": 500,
      "depth": 500,
      "height": 850,
      "object_spec_id": "object-chair-500x500"
    },
    "placement": {
      "mode": "absolute",
      "base_point": [
        7300.0,
        1650.0,
        0
      ]
    },
    "drawing": {
      "layer": "CODEX_PREVIEW",
      "include_label": false,
      "include_dimensions": false
    },
    "confidence": 0.9,
    "needs_confirmation": false
  }
]
