{
  "version": "0.1",
  "domain": "generic",
  "intent": "draw_object",
  "object": {
    "type": "table",
    "name": "Phase 10 rehearsal table",
    "width": 900,
    "depth": 450
  },
  "placement": {
    "mode": "absolute",
    "base_point": [
      76000,
      42000,
      0
    ]
  },
  "drawing": {
    "layer": "CODEX_PREVIEW",
    "include_label": false,
    "include_dimensions": false
  },
  "confidence": 0.91,
  "needs_confirmation": false
}
