{
  "version": "0.1",
  "domain": "residential",
  "intent": "draw_object",
  "object": {
    "type": "chair",
    "name": "Chair",
    "width": 500,
    "depth": 500,
    "height": 850,
    "object_spec_id": "object-chair-500x500",
    "instance_id": "chair-03",
    "role": "dining_seat",
    "composition_id": "dining_table_set"
  },
  "placement": {
    "mode": "absolute",
    "base_point": [
      900,
      1600,
      0
    ]
  },
  "drawing": {
    "layer": "CODEX_PREVIEW",
    "include_label": false,
    "include_dimensions": false
  },
  "confidence": 0.9,
  "needs_confirmation": false
}
