{
  "version": "0.1",
  "domain": "generic",
  "intent": "draw_object",
  "object": {
    "type": "probe",
    "name": "P10受控预览探针",
    "width": 800,
    "depth": 400
  },
  "placement": {
    "mode": "absolute",
    "base_point": [
      88000,
      88000,
      0
    ]
  },
  "drawing": {
    "layer": "CODEX_PREVIEW",
    "include_label": false,
    "include_dimensions": false
  },
  "confidence": 0.9,
  "needs_confirmation": false
}
