{
  "version": "0.1",
  "domain": "generic",
  "intent": "draw_object",
  "object": {
    "type": "desk",
    "name": "Desk",
    "width": 1400,
    "depth": 700,
    "height": 750,
    "object_spec_id": "object-desk-1400x700"
  },
  "placement": {
    "mode": "absolute",
    "base_point": [
      0.0,
      0.0,
      0
    ]
  },
  "drawing": {
    "layer": "CODEX_PREVIEW",
    "include_label": false,
    "include_dimensions": false
  },
  "confidence": 0.9,
  "needs_confirmation": false
}
