{
  "version": "0.1",
  "domain": "generic",
  "intent": "draw_object",
  "object": {
    "type": "computer_desk",
    "name": "Computer Desk",
    "width": 7900.0,
    "depth": 3950.0,
    "height": 750,
    "object_spec_id": "object-computer_desk-7900x3950"
  },
  "placement": {
    "mode": "absolute",
    "base_point": [
      6100.0,
      0.0,
      0
    ]
  },
  "drawing": {
    "layer": "CODEX_PREVIEW",
    "include_label": false,
    "include_dimensions": false
  },
  "confidence": 0.9,
  "needs_confirmation": false
}
