{
  "version": "0.1",
  "domain": "generic",
  "intent": "draw_annotation",
  "object": {
    "type": "leader_note",
    "name": "Intent Lab Annotation"
  },
  "placement": {
    "mode": "absolute",
    "base_point": [3000, 1000, 0]
  },
  "drawing": {
    "layer": "CODEX_PREVIEW"
  },
  "confidence": 1.0,
  "needs_confirmation": false
}
