{
  "version": "0.1",
  "domain": "generic",
  "intent": "draw_object",
  "object": {
    "type": "computer_desk",
    "name": "Computer Desk",
    "width": 1200,
    "depth": 700,
    "height": 750,
    "object_spec_id": "object-computer_desk-1200x700"
  },
  "placement": {
    "mode": "absolute",
    "base_point": [
      0,
      0,
      0
    ]
  },
  "drawing": {
    "layer": "CODEX_PREVIEW",
    "include_label": false,
    "include_dimensions": false
  },
  "confidence": 0.9,
  "needs_confirmation": false
}
