{
  "version": "0.1",
  "domain": "generic",
  "intent": "draw_object",
  "object": {
    "type": "file_cabinet",
    "name": "File Cabinet",
    "width": 900,
    "depth": 450,
    "height": 1100,
    "object_spec_id": "object-file_cabinet-900x450"
  },
  "placement": {
    "mode": "absolute",
    "base_point": [
      0,
      0,
      0
    ]
  },
  "drawing": {
    "layer": "CODEX_PREVIEW",
    "include_label": false,
    "include_dimensions": false
  },
  "confidence": 0.9,
  "needs_confirmation": false
}
